{
  "schemaVersion": 1,
  "workItemId": "ITER-GRADE-BOUNDARY-20260929",
  "mode": "single",
  "rationale": "评分进程、结果字段和回归测试为一个安全边界的连续纵向修改",
  "tasks": [
    {
      "id": "T1",
      "title": "隔离评分进程环境并规范化诊断字段",
      "module": "benchmarks",
      "status": "IN_REVIEW",
      "attempt": 1,
      "blockedBy": [],
      "blocks": [],
      "writeScopes": [
        "benchmarks/runner.mjs",
        "benchmarks/tests/runner.test.mjs",
        "benchmarks/README.md"
      ],
      "verification": [
        "node --test benchmarks/tests/multifile.test.mjs benchmarks/tests/project-v2.test.mjs benchmarks/tests/report.test.mjs benchmarks/tests/resume.test.mjs benchmarks/tests/runner.test.mjs benchmarks/tests/spec-guidance.test.mjs benchmarks/tests/status.test.mjs"
      ],
      "checks": [
        {
          "id": "V1",
          "command": "node",
          "args": [
            "--test",
            "benchmarks/tests/multifile.test.mjs",
            "benchmarks/tests/project-v2.test.mjs",
            "benchmarks/tests/report.test.mjs",
            "benchmarks/tests/resume.test.mjs",
            "benchmarks/tests/runner.test.mjs",
            "benchmarks/tests/spec-guidance.test.mjs",
            "benchmarks/tests/status.test.mjs"
          ]
        }
      ],
      "docsImpact": [
        "benchmarks/README.md"
      ],
      "reviewBatch": "R1",
      "risk": "high",
      "owner": "primary-ai",
      "verificationStatus": "pass",
      "reviewStatus": "fail",
      "evidence": [
        "73f4123c-e1d6-4385-8c8b-4f9b72914627",
        "1685fc7e-92a1-4479-ac49-77465ea98a84"
      ],
      "deferralApproval": null,
      "verificationSource": {
        "digest": "ddcf94a1497ffac55bf1ea15693b29c2d7006b13b2a4c7d4428760d6f045f00b",
        "document": ".ai-harness/work-items/ITER-GRADE-BOUNDARY-20260929/snapshots/ddcf94a1497ffac55bf1ea15693b29c2d7006b13b2a4c7d4428760d6f045f00b.json"
      }
    }
  ],
  "reviewBatches": [
    {
      "id": "R1",
      "title": "评分器敏感信息边界",
      "risk": "high",
      "taskIds": [
        "T1"
      ],
      "independentRequired": true
    }
  ],
  "createdAt": "2026-09-29T01:16:14.143Z",
  "updatedAt": "2026-09-29T01:30:30.243Z",
  "revision": 2
}
