{
  "schemaVersion": 1,
  "workItemId": "BUG-INSTALL-WRITE-BOUNDARY-20261012",
  "mode": "single",
  "rationale": "安装边界的一次纵向修复，单 AI 实施和独立高风险审查，测试与实现相互依赖。",
  "tasks": [
    {
      "id": "T1",
      "title": "保护安装与初始化目标",
      "module": ".ai-harness/src/installer.mjs",
      "status": "COMPLETED",
      "attempt": 1,
      "blockedBy": [],
      "blocks": [],
      "writeScopes": [
        ".ai-harness/src/installer.mjs",
        ".ai-harness/tests/installer.test.mjs"
      ],
      "verification": [
        "node --test .ai-harness/tests/installer.test.mjs",
        "node --test .ai-harness/tests/installer-checkout.test.mjs",
        "node .ai-harness/tests/run.mjs",
        "node --check .ai-harness/src/installer.mjs"
      ],
      "checks": [
        {
          "id": "V1",
          "command": "node",
          "args": [
            "--test",
            ".ai-harness/tests/installer.test.mjs"
          ]
        },
        {
          "id": "V2",
          "command": "node",
          "args": [
            "--test",
            ".ai-harness/tests/installer-checkout.test.mjs"
          ]
        },
        {
          "id": "V3",
          "command": "node",
          "args": [
            ".ai-harness/tests/run.mjs"
          ]
        },
        {
          "id": "V4",
          "command": "node",
          "args": [
            "--check",
            ".ai-harness/src/installer.mjs"
          ]
        }
      ],
      "docsImpact": [
        "N/A: 修复已有不越界及保留用户编辑语义，方案和边界记录于本工作项 solution.md"
      ],
      "reviewBatch": "R1",
      "risk": "high",
      "owner": "primary-ai",
      "verificationStatus": "pass",
      "reviewStatus": "pass",
      "evidence": [
        "5e476915-4597-4b34-81b4-a75b236dd013",
        "201addf7-41f2-49df-9a94-10e76ebd1bc8"
      ],
      "deferralApproval": null,
      "verificationSource": {
        "digest": "cc5e4126b8cef10f7e4f7119621eedeca57841b9923781d3e96dc2dc5750333b",
        "document": ".ai-harness/work-items/BUG-INSTALL-WRITE-BOUNDARY-20261012/snapshots/cc5e4126b8cef10f7e4f7119621eedeca57841b9923781d3e96dc2dc5750333b.json"
      },
      "reviewSource": {
        "digest": "cc5e4126b8cef10f7e4f7119621eedeca57841b9923781d3e96dc2dc5750333b",
        "document": ".ai-harness/work-items/BUG-INSTALL-WRITE-BOUNDARY-20261012/snapshots/cc5e4126b8cef10f7e4f7119621eedeca57841b9923781d3e96dc2dc5750333b.json"
      }
    }
  ],
  "reviewBatches": [
    {
      "id": "R1",
      "title": "安装及初始化目标写入",
      "risk": "high",
      "taskIds": [
        "T1"
      ],
      "independentRequired": true
    }
  ],
  "createdAt": "2026-10-12T09:07:08.177Z",
  "updatedAt": "2026-10-12T09:24:45.926Z"
}
