{
  "schemaVersion": 1,
  "workItemId": "pagination-fix",
  "mode": "single",
  "rationale": "先复现，完整集合过滤并排序，再校验游标并排他切页，以剩余记录判断下一游标",
  "tasks": [
    {
      "id": "T1",
      "title": "修复归档过滤与游标分页",
      "module": "compact",
      "status": "IN_PROGRESS",
      "attempt": 1,
      "blockedBy": [],
      "blocks": [],
      "writeScopes": [
        "src/pagination.mjs",
        "src/repository.mjs",
        "test/extra.test.mjs"
      ],
      "verification": [
        "node --test test/public.test.mjs test/extra.test.mjs"
      ],
      "checks": [
        {
          "id": "V1",
          "command": "node",
          "args": [
            "--test",
            "test/public.test.mjs",
            "test/extra.test.mjs"
          ]
        }
      ],
      "docsImpact": [
        "N/A: 规格不变，无文档修改授权"
      ],
      "reviewBatch": "R1",
      "risk": "low",
      "owner": "primary-ai",
      "verificationStatus": "pending",
      "reviewStatus": "pending",
      "evidence": [],
      "deferralApproval": null
    }
  ],
  "reviewBatches": [
    {
      "id": "R1",
      "title": "修复归档过滤与游标分页",
      "risk": "low",
      "taskIds": [
        "T1"
      ],
      "independentRequired": false
    }
  ],
  "createdAt": "2026-10-14T03:03:48.401Z",
  "updatedAt": "2026-10-14T03:03:48.427Z"
}
