{
  "schemaVersion": 1,
  "workItemId": "ITER-CONTAINER-CODEX-DRIVER-20261015",
  "mode": "single",
  "rationale": "容器manifest、身份重验、driver生命周期、恢复/status和测试构成单一安全纵向能力，拆分会造成不可验证的中间协议",
  "tasks": [
    {
      "id": "T1",
      "title": "实现容器化Codex driver及兼容验证",
      "module": "benchmarks",
      "status": "IN_PROGRESS",
      "attempt": 1,
      "blockedBy": [],
      "blocks": [],
      "writeScopes": [
        "benchmarks/codex-container.mjs",
        "benchmarks/codex-driver.mjs",
        "benchmarks/client-drivers.mjs",
        "benchmarks/experiment.mjs",
        "benchmarks/run.mjs",
        "benchmarks/status.mjs",
        "benchmarks/tests/container-driver.test.mjs",
        "benchmarks/tests/memory-control.test.mjs",
        "benchmarks/tests/resume.test.mjs",
        "benchmarks/tests/status.test.mjs",
        "benchmarks/README.md"
      ],
      "verification": [
        "node --test benchmarks/tests/container-driver.test.mjs benchmarks/tests/memory-control.test.mjs benchmarks/tests/resume.test.mjs benchmarks/tests/status.test.mjs benchmarks/tests/driver-process.test.mjs benchmarks/tests/driver-diagnostics.test.mjs",
        "node benchmarks/tests/run.mjs",
        "node .ai-harness/work-items/ITER-MEMORY-PREFLIGHT-20261015/verify-history.test.mjs"
      ],
      "checks": [
        {
          "id": "V1",
          "command": "node",
          "args": [
            "--test",
            "benchmarks/tests/container-driver.test.mjs",
            "benchmarks/tests/memory-control.test.mjs",
            "benchmarks/tests/resume.test.mjs",
            "benchmarks/tests/status.test.mjs",
            "benchmarks/tests/driver-process.test.mjs",
            "benchmarks/tests/driver-diagnostics.test.mjs"
          ]
        },
        {
          "id": "V2",
          "command": "node",
          "args": [
            "benchmarks/tests/run.mjs"
          ]
        },
        {
          "id": "V3",
          "command": "node",
          "args": [
            ".ai-harness/work-items/ITER-MEMORY-PREFLIGHT-20261015/verify-history.test.mjs"
          ]
        }
      ],
      "docsImpact": [
        "benchmarks/README.md"
      ],
      "reviewBatch": "R1",
      "risk": "high",
      "owner": "primary-ai",
      "verificationStatus": "pending",
      "reviewStatus": "pending",
      "evidence": [],
      "deferralApproval": null
    }
  ],
  "reviewBatches": [
    {
      "id": "R1",
      "title": "容器Codex执行边界",
      "risk": "high",
      "taskIds": [
        "T1"
      ],
      "independentRequired": true
    }
  ],
  "createdAt": "2026-10-15T05:53:01.538Z",
  "updatedAt": "2026-10-15T05:53:02.216Z"
}
